{
  "$schema": "https://json-schema.org/draft/2020-12/schema",
  "$id": "cognitive-runtime.activation-receipt/v3",
  "title": "Composite Activation Receipt",
  "type": "object",
  "additionalProperties": false,
  "required": ["schema_version", "receipt_id", "instance_id", "generation_id", "source_revision", "authority", "domains", "manifest_checksum", "projection_checksum", "host_config_checksum", "index_evidence", "release_channel", "openclaw_version", "node_version", "verified_at"],
  "properties": {
    "schema_version": { "const": "cognitive-runtime.activation-receipt/v3" },
    "receipt_id": { "$ref": "#/$defs/id" },
    "instance_id": { "$ref": "#/$defs/id" },
    "generation_id": { "$ref": "#/$defs/generation" },
    "source_revision": { "$ref": "#/$defs/authorityRevision" },
    "authority": { "$ref": "#/$defs/authority" },
    "domains": { "$ref": "#/$defs/domains" },
    "manifest_checksum": { "$ref": "#/$defs/checksum" },
    "projection_checksum": { "$ref": "#/$defs/checksum" },
    "host_config_checksum": { "$ref": "#/$defs/checksum" },
    "index_evidence": {
      "type": "object",
      "additionalProperties": false,
      "required": ["deep_status", "search_sentinel_checksum", "get_sentinel_checksum", "fitness"],
      "properties": {
        "deep_status": { "const": "pass" },
        "search_sentinel_checksum": { "$ref": "#/$defs/checksum" },
        "get_sentinel_checksum": { "$ref": "#/$defs/checksum" },
        "fitness": { "$ref": "#/$defs/fitnessIndexEvidence" }
      }
    },
    "cutover_plan_checksum": { "$ref": "#/$defs/checksum" },
    "release_channel": { "type": "string", "minLength": 1 },
    "openclaw_version": { "type": "string", "minLength": 1 },
    "node_version": { "type": "string", "minLength": 1 },
    "verified_at": { "type": "string", "format": "date-time" }
  },
  "$defs": {
    "id": { "type": "string", "pattern": "^[a-z0-9][a-z0-9._-]{0,127}$" },
    "authorityRevision": { "type": "string", "pattern": "^[a-f0-9]{40}$" },
    "sourceRevision": { "type": "string", "pattern": "^[A-Za-z0-9][A-Za-z0-9._:-]{0,255}$" },
    "generation": { "type": "string", "pattern": "^generation-[a-f0-9]{64}$" },
    "projectionRevision": { "type": "string", "pattern": "^projection-[a-f0-9]{64}$" },
    "pointerRevision": { "type": "string", "pattern": "^pointer-[a-f0-9]{64}$" },
    "checksum": { "type": "string", "pattern": "^sha256:[a-f0-9]{64}$" },
    "authority": { "type": "object", "additionalProperties": false, "required": ["revision", "checksum"], "properties": { "revision": { "$ref": "#/$defs/authorityRevision" }, "checksum": { "$ref": "#/$defs/checksum" } } },
    "domain": { "type": "object", "additionalProperties": false, "required": ["domain_id", "status", "projection_revision", "pointer_revision", "manifest_checksum", "source_revision", "as_of"], "properties": { "domain_id": { "$ref": "#/$defs/id" }, "status": { "enum": ["active", "stale"] }, "projection_revision": { "$ref": "#/$defs/projectionRevision" }, "pointer_revision": { "$ref": "#/$defs/pointerRevision" }, "manifest_checksum": { "$ref": "#/$defs/checksum" }, "source_revision": { "$ref": "#/$defs/sourceRevision" }, "as_of": { "type": "string", "format": "date-time" } } },
    "domains": { "type": "array", "minItems": 1, "maxItems": 32, "items": { "$ref": "#/$defs/domain" } },
    "fitnessIndexEvidence": {
      "type": "object",
      "additionalProperties": false,
      "required": ["projection_revision", "manifest_checksum", "desired_count", "indexed_count", "previous_revision", "previous_stable_id_hits", "previous_text_sentinel_hits", "previous_source_reference_hits"],
      "properties": {
        "projection_revision": { "$ref": "#/$defs/projectionRevision" },
        "manifest_checksum": { "$ref": "#/$defs/checksum" },
        "desired_count": { "type": "integer", "minimum": 0 },
        "indexed_count": { "type": "integer", "minimum": 0 },
        "previous_revision": { "oneOf": [{ "$ref": "#/$defs/projectionRevision" }, { "type": "null" }] },
        "previous_stable_id_hits": { "const": 0 },
        "previous_text_sentinel_hits": { "const": 0 },
        "previous_source_reference_hits": { "const": 0 }
      }
    }
  }
}
