{"schema_version":"cognitive-runtime.activation-receipt/v3","receipt_id":"activation-synthetic-v3","instance_id":"instance-synthetic","generation_id":"generation-aaaaaaaaaaaaaaaaaaaaaaaaaaaaaaaaaaaaaaaaaaaaaaaaaaaaaaaaaaaaaaaa","source_revision":"aaaaaaaaaaaaaaaaaaaaaaaaaaaaaaaaaaaaaaaa","authority":{"revision":"aaaaaaaaaaaaaaaaaaaaaaaaaaaaaaaaaaaaaaaa","checksum":"sha256:0000000000000000000000000000000000000000000000000000000000000000"},"domains":[{"domain_id":"fitness","status":"active","projection_revision":"projection-1111111111111111111111111111111111111111111111111111111111111111","pointer_revision":"pointer-2222222222222222222222222222222222222222222222222222222222222222","manifest_checksum":"sha256:3333333333333333333333333333333333333333333333333333333333333333","source_revision":"fitness-1","as_of":"2026-08-24T00:00:00Z"}],"manifest_checksum":"sha256:4444444444444444444444444444444444444444444444444444444444444444","projection_checksum":"sha256:5555555555555555555555555555555555555555555555555555555555555555","host_config_checksum":"sha256:6666666666666666666666666666666666666666666666666666666666666666","index_evidence":{"deep_status":"pass","search_sentinel_checksum":"sha256:7777777777777777777777777777777777777777777777777777777777777777","get_sentinel_checksum":"sha256:8888888888888888888888888888888888888888888888888888888888888888","fitness":{"projection_revision":"projection-1111111111111111111111111111111111111111111111111111111111111111","manifest_checksum":"sha256:3333333333333333333333333333333333333333333333333333333333333333","desired_count":1,"indexed_count":1,"previous_revision":null,"previous_stable_id_hits":0,"previous_text_sentinel_hits":0,"previous_source_reference_hits":0}},"release_channel":"extended-stable","openclaw_version":"2026.6.34","node_version":"24.9.0","verified_at":"2026-08-24T00:01:00Z"}
